{
  "id": "tmpa-s0.4-case-profile",
  "version": "1.0.0",
  "states": ["created", "active", "review", "done", "archive"],
  "initial_state": "created",
  "terminal_states": ["archive"],
  "actions": ["start", "submit", "approve", "archive"],
  "transitions": [
    {
      "from": "created",
      "action": "start",
      "to": "active",
      "allowed_roles": ["PM"],
      "required_relations": []
    },
    {
      "from": "active",
      "action": "submit",
      "to": "review",
      "allowed_roles": ["DEV"],
      "required_relations": ["reports"]
    },
    {
      "from": "review",
      "action": "approve",
      "to": "done",
      "allowed_roles": ["QA"],
      "required_relations": ["reviews"],
      "separation_of_duties": ["executor_must_not_review"]
    },
    {
      "from": "done",
      "action": "archive",
      "to": "archive",
      "allowed_roles": ["OPS"],
      "required_relations": ["archives"]
    }
  ],
  "recovery_rules": ["terminal_state_is_stable", "source_history_is_preserved"],
  "extensions": {
    "document_types": ["TASK", "TRANSITION", "REPORT", "REVIEW", "DECISION", "CORRECTION", "ISSUE"],
    "assignments": [
      { "identity": "alice", "role": "PM", "actions": ["start"] },
      { "identity": "bob", "role": "DEV", "actions": ["submit"] },
      { "identity": "bob", "role": "QA", "actions": ["approve"] },
      { "identity": "carol", "role": "QA", "actions": ["approve"] },
      { "identity": "dave", "role": "OPS", "actions": ["archive"] },
      { "identity": "erin", "role": "ADMIN", "actions": [] }
    ],
    "ordering_relations": ["depends_on", "reports", "reviews", "archives"],
    "acyclic_relations": ["depends_on"]
  }
}
